{
 "tape_version": 1,
 "scenario": "crm",
 "title": "A second domain: CRM, configuration only",
 "recorded_with": {
  "git_sha": "946ae18",
  "ontology": "personal-knowledge-governance.yaml",
  "router": "mock (strict fixtures)"
 },
 "steps": [
  {
   "id": "1",
   "title": "Publish the CRM ontology; register the app",
   "calls": [
    {
     "method": "GET",
     "path": "/v1/me",
     "query": {},
     "caller": "admin",
     "request": null,
     "status": 200,
     "response": {
      "principal": {
       "id": "id_135",
       "handle": "admin@ex-tape-crm-261019052015",
       "kind": "user",
       "roles": [
        "workspace_admin"
       ]
      },
      "workspace": {
       "id": "id_136",
       "slug": "ex-tape-crm-261019052015",
       "display_name": "Example tape-crm",
       "status": "active"
      }
     }
    },
    {
     "method": "POST",
     "path": "/v1/principals/id_135/grants",
     "query": {},
     "caller": "admin",
     "request": {
      "scope_kind": "subject",
      "scope_ref": "*",
      "privileges": [
       "read",
       "propose",
       "publish"
      ]
     },
     "status": 201,
     "response": {
      "id": "id_137",
      "principal_id": "id_135",
      "scope_kind": "subject",
      "scope_ref": "*",
      "privileges": [
       "read",
       "propose",
       "publish"
      ],
      "created_at": "2026-10-18T09:02:28Z"
     }
    },
    {
     "method": "POST",
     "path": "/v1/principals/id_135/grants",
     "query": {},
     "caller": "admin",
     "request": {
      "scope_kind": "project",
      "scope_ref": "*",
      "privileges": [
       "read",
       "propose",
       "publish"
      ]
     },
     "status": 201,
     "response": {
      "id": "id_138",
      "principal_id": "id_135",
      "scope_kind": "project",
      "scope_ref": "*",
      "privileges": [
       "read",
       "propose",
       "publish"
      ],
      "created_at": "2026-10-18T09:02:29Z"
     }
    },
    {
     "method": "POST",
     "path": "/v1/principals",
     "query": {},
     "caller": "admin",
     "request": {
      "kind": "app",
      "handle": "conversation-app",
      "display_name": "conversation-app",
      "trusted_source": true,
      "grants": [
       {
        "scope_kind": "subject",
        "scope_ref": "*",
        "privileges": [
         "read",
         "propose",
         "publish"
        ]
       }
      ]
     },
     "status": 201,
     "response": {
      "principal": {
       "id": "id_139",
       "kind": "app",
       "handle": "conversation-app",
       "display_name": "conversation-app",
       "description": "",
       "status": "active",
       "roles": [
        "app_writer"
       ],
       "owner_principal_id": null,
       "trusted_source": true,
       "model_disclosure": "allowed",
       "allowed_profiles": [],
       "quotas": {
        "requests_per_minute": null,
        "context_tokens_per_day": null,
        "interactions_per_day": null
       },
       "revoke_reason": null,
       "revoked_at": null,
       "revoked_by": null,
       "created_at": "2026-10-18T09:02:30Z",
       "updated_at": "2026-10-18T09:02:30Z",
       "revision": 1
      },
      "key": {
       "id": "id_140",
       "name": "initial",
       "prefix": "aCGaide4",
       "created_at": "2026-10-18T09:02:30Z",
       "expires_at": null,
       "revoked_at": null,
       "last_used_at": null,
       "plaintext": "kgk_EXAMPLE"
      },
      "grants": [
       {
        "id": "id_141",
        "principal_id": "id_139",
        "scope_kind": "subject",
        "scope_ref": "*",
        "privileges": [
         "read",
         "propose",
         "publish"
        ],
        "created_at": "2026-10-18T09:02:30Z"
       }
      ]
     }
    },
    {
     "method": "GET",
     "path": "/v1/ontologies/active",
     "query": {},
     "caller": "admin",
     "request": null,
     "status": 200,
     "response": {
      "version": {
       "id": "id_142",
       "ontology_key": "crm-accounts",
       "version": "1.0.0",
       "state": "published",
       "active": true,
       "content_hash": "264f910caf4943cfaffdd0e0bd930e7ffe564bd273f1e0074156acdd35f54385",
       "revision": 2,
       "error_count": 0,
       "notes": "seeded from examples/ontologies",
       "created_at": "2026-10-18T09:02:27Z",
       "published_at": "2026-10-18T09:02:27Z",
       "retired_at": null
      },
      "entity_types": [
       "Contact",
       "Customer",
       "Deal",
       "Product",
       "Project",
       "Ticket"
      ],
      "relationship_types": [
       {
        "type": "BLOCKED_BY",
        "source": "Project",
        "target": "Ticket"
       },
       {
        "type": "DEAL_FOR",
        "source": "Deal",
        "target": "Customer"
       },
       {
        "type": "ESCALATED_TO",
        "source": "Ticket",
        "target": "Contact"
       },
       {
        "type": "HAS_ACCOUNT_OWNER",
        "source": "Customer",
        "target": "Contact"
       },
       {
        "type": "PROJECT_FOR",
        "source": "Project",
        "target": "Customer"
       },
       {
        "type": "SPONSORS",
        "source": "Contact",
        "target": "Project"
       },
       {
        "type": "USES_PRODUCT",
        "source": "Customer",
        "target": "Product"
       },
       {
        "type": "WORKS_FOR",
        "source": "Contact",
        "target": "Customer"
       }
      ]
     }
    }
   ]
  },
  {
   "id": "2",
   "title": "The CRM system of record writes customers, contacts and a backdated job change by command",
   "calls": [
    {
     "method": "POST",
     "path": "/v1/entities",
     "query": {},
     "caller": "conversation-app",
     "request": {
      "type": "Customer",
      "name": "Globex",
      "source_system": "crm",
      "external_ids": [
       {
        "system": "crm",
        "value": "CUST-1"
       }
      ],
      "source_ref": "CUST-1",
      "attributes": {
       "renewal_date": "2026-12-15",
       "budget_owner": "Dana Reyes"
      }
     },
     "status": 201,
     "response": {
      "command_id": "id_143",
      "command_type": "entity.create",
      "status": "applied",
      "matched_existing": false,
      "entity_id": "globex",
      "fact_id": null,
      "ended_fact_ids": [],
      "review_item_id": null,
      "ontology_version_id": "id_142",
      "projection_status": "projected",
      "status_url": "/v1/commands/id_143"
     }
    },
    {
     "method": "POST",
     "path": "/v1/entities",
     "query": {},
     "caller": "conversation-app",
     "request": {
      "type": "Customer",
      "name": "Initech",
      "source_system": "crm",
      "external_ids": [
       {
        "system": "crm",
        "value": "CUST-2"
       }
      ],
      "source_ref": "CUST-2",
      "attributes": {}
     },
     "status": 201,
     "response": {
      "command_id": "id_144",
      "command_type": "entity.create",
      "status": "applied",
      "matched_existing": false,
      "entity_id": "initech",
      "fact_id": null,
      "ended_fact_ids": [],
      "review_item_id": null,
      "ontology_version_id": "id_142",
      "projection_status": "projected",
      "status_url": "/v1/commands/id_144"
     }
    },
    {
     "method": "POST",
     "path": "/v1/entities",
     "query": {},
     "caller": "conversation-app",
     "request": {
      "type": "Contact",
      "name": "Dana Reyes",
      "source_system": "crm",
      "external_ids": [
       {
        "system": "crm",
        "value": "CON-1"
       }
      ],
      "source_ref": "CON-1"
     },
     "status": 201,
     "response": {
      "command_id": "id_145",
      "command_type": "entity.create",
      "status": "applied",
      "matched_existing": false,
      "entity_id": "dana",
      "fact_id": null,
      "ended_fact_ids": [],
      "review_item_id": null,
      "ontology_version_id": "id_142",
      "projection_status": "projected",
      "status_url": "/v1/commands/id_145"
     }
    },
    {
     "method": "POST",
     "path": "/v1/entities",
     "query": {},
     "caller": "conversation-app",
     "request": {
      "type": "Contact",
      "name": "Marcus Lee",
      "source_system": "crm",
      "external_ids": [
       {
        "system": "crm",
        "value": "CON-2"
       }
      ],
      "source_ref": "CON-2"
     },
     "status": 201,
     "response": {
      "command_id": "id_146",
      "command_type": "entity.create",
      "status": "applied",
      "matched_existing": false,
      "entity_id": "marcus",
      "fact_id": null,
      "ended_fact_ids": [],
      "review_item_id": null,
      "ontology_version_id": "id_142",
      "projection_status": "projected",
      "status_url": "/v1/commands/id_146"
     }
    },
    {
     "method": "POST",
     "path": "/v1/entities",
     "query": {},
     "caller": "conversation-app",
     "request": {
      "type": "Contact",
      "name": "Priya Shah",
      "source_system": "crm",
      "external_ids": [
       {
        "system": "crm",
        "value": "CON-3"
       }
      ],
      "source_ref": "CON-3"
     },
     "status": 201,
     "response": {
      "command_id": "id_147",
      "command_type": "entity.create",
      "status": "applied",
      "matched_existing": false,
      "entity_id": "priya",
      "fact_id": null,
      "ended_fact_ids": [],
      "review_item_id": null,
      "ontology_version_id": "id_142",
      "projection_status": "projected",
      "status_url": "/v1/commands/id_147"
     }
    },
    {
     "method": "POST",
     "path": "/v1/entities",
     "query": {},
     "caller": "conversation-app",
     "request": {
      "type": "Product",
      "name": "Atlas Platform",
      "source_system": "crm",
      "source_ref": "PRD-1"
     },
     "status": 201,
     "response": {
      "command_id": "id_148",
      "command_type": "entity.create",
      "status": "applied",
      "matched_existing": false,
      "entity_id": "atlas",